{
  "$schema": "https://json-schema.org/draft/2020-12/schema",
  "title": "Independent topic Problem Reviewer output",
  "type": "object",
  "additionalProperties": false,
  "required": [
    "candidate_id",
    "verdict",
    "source_fidelity",
    "scope_change",
    "authoritative_alignment",
    "concerns",
    "revision_instructions",
    "rationale"
  ],
  "properties": {
    "candidate_id": {"type": "string"},
    "verdict": {"enum": ["accept", "revise", "reject"]},
    "source_fidelity": {
      "description": "Whether source facts, quotations, attribution, and the derivation bridge are honest. This may pass for an explicitly derived, scientifically defensible generalization; literal equality with a source question is not required.",
      "enum": ["pass", "fail"]
    },
    "scope_change": {"enum": ["pass", "fail", "not_applicable"]},
    "authoritative_alignment": {"enum": ["pass", "fail", "not_applicable"]},
    "concerns": {"type": "array", "items": {"type": "string"}},
    "revision_instructions": {"type": "array", "items": {"type": "string"}},
    "rationale": {"type": "string"}
  }
}
