{
  "candidate_id": "CAN-03FCC40AF914",
  "verdict": "accept",
  "source_fidelity": "pass",
  "scope_change": "not_applicable",
  "authoritative_alignment": "pass",
  "concerns": [
    "The literature_treatment asserts that Troyer-Wiese 'is cited in current work (2025-2026 arXiv literature) as the reason a generic solution is not expected', but no evidence item documents this forward-citation context; the claim is untraceable and should either be supported by an evidence item or removed. It is not load-bearing for the verdict, since the RMP 2022 review and the 2024 Pan-Meng encyclopedia chapter already provide direct same-core evidence of continuing openness.",
    "The two key status evidence items (RMP 2022, Pan-Meng 2024) are abstract-level; the abstracts do directly present the problem as unsolved, but full-text inspection would strengthen the record.",
    "ci_pseudocode opens with the word 'Placeholder', which reads as unfinished even though the content honestly disclaims automated checking and describes a concrete partial replay procedure (pinned code, seeds, N/beta grid, recomputed costs, signs, and error bars). The wording should be cleaned up so it does not look like a stub."
  ],
  "revision_instructions": [],
  "rationale": "Source fidelity passes: the canonical statement follows source-faithfully from the Dornheim lead (arXiv:2104.10032), which documents the exponential wall S = exp(-beta N Delta f) in fermionic PIMC without posing an explicit open question, and the derivation rationale correctly keeps the question at the source's full generality with no model, ensemble, temperature, or answer-form restriction; the injected NP-hardness context is directly supported by the cited Troyer-Wiese abstract. formulation_change.changed is false, so scope_change is correctly not_applicable, and since no later evidence narrows the core, the unchanged expected_result and verification difficulty need no new justification. Authoritative alignment passes: this is the famous fermion sign problem, the cited standard formulation is the genuine Troyer-Wiese PRL 94, 170201 abstract quoted verbatim, and the 'equivalent' classification is accurate — the canonical statement preserves the source's generality rather than presenting a restricted variant under the famous name. Status is adequately supported: two direct, non-metadata, same-core review-level items (RMP 94, 015006; 2024 encyclopedia chapter) treat the problem as unsolved, the contested Wang-Sun preprint claim is explicitly inspected and separated as adjacent rather than counted as closure, and the absence-based conclusion is paired with likely_open and medium confidence consistent with the documented web-only coverage. The significance score of 9 is justified by the capability frontier at stake in both resolution directions. Verification difficulty 8 is sound under the rubric: neither acceptance branch yields a finite witness (the construction branch's sub-exponential scaling is an asymptotic, uniform claim that no finite replay can certify, so scoring the witness-checking cost does not apply), both branches reduce to long connected derivation review plus nontrivial specification-fidelity reconstruction, and the cheapest-sound-branch rule therefore does not lower the score; no burden is hidden in a specification gap and no proxy benchmark is invented. The CI layer is honest: automated checking is explicitly disclaimed (ci_runner none, solution-reviewer-only), so no oracle-like contract is claimed, and the hypothetical replay description names a terminating procedure with concrete inputs and outputs rather than 'verify the claim'. No resolved/refuted/major-progress judgment depends on agent-invented results — the still_open conclusion rests entirely on external literature. All publish gates (source_fidelity pass, scope_change not_applicable, authoritative_alignment pass, verification_clarity clear) are met; the untraceable 2025-2026 citation remark and the 'Placeholder' wording are non-load-bearing and noted as concerns only."
}
