{
  "candidate_id": "CAN-FCFD93A87E78",
  "verdict": "accept",
  "source_fidelity": "pass",
  "scope_change": "not_applicable",
  "authoritative_alignment": "pass",
  "concerns": [
    "The LKM/Gaia route was unavailable, so the status audit rests on web-only coverage; this limitation is honestly stated and mitigated by direct 2023-2026 same-core evidence, but very recent preprint coverage cannot be certified complete.",
    "The characterization of STAR BES-II results as 'ruling out a critical point in regions accessed at top RHIC and LHC energies' rests on abstract-level and public-summary material rather than full-text inspection; it is used only as contextual narrowing evidence and is not load-bearing for the still_open conclusion.",
    "Three of seven evidence items are metadata-level only; they are correctly labeled non-direct and supplementary, and the direct full-text, abstract-level, and partial-full-text items carry the load, so this is informational rather than a defect."
  ],
  "revision_instructions": [],
  "rationale": "Source fidelity passes: the canonical title, statement, and scope reproduce the Nagata 2022 review's authoritative formulation verbatim (exact excerpt supplied and consistent across the candidate, source record, and assessment), and the connection to the sign problem is presented as the source's documented reason the problem is open, not as an added method restriction. formulation_change.changed is false, so scope_change is not_applicable, and the frozen formulation is justified by the cited post-2022 evidence (2-sigma ansatz-dependent regional exclusions and baseline-dependent experimental deviations that narrow but do not close the question). The problem is named and formulation_alignment 'exact' is supported by the cited primary standard review, so authoritative_alignment passes. Current status is supported by at least one traceable, non-metadata, direct same-core item — in fact several: the full-text Nagata review anchor, abstract-level direct items for Borsanyi et al. 2025 and STAR BES-II 2025, and a partial-full-text 2023 review confirming no sign-problem method provides a final solution; the systematic same-core search, continuing active treatment by lattice/functional/experimental programs, and explicit separation of adjacent results (heavy-quark-region critical point correctly flagged as a different corner) justify still_open with likely_open at the stated confidence. major_progress_found false with surviving core equal to the full source question is consistent with that evidence, and no triage score was decreased, so no unexplained-change issue arises. Scientific significance 9 is argued concretely (phase-diagram structure, experimental-program redirection, EOS constraints, transferable sign-problem methodology) and the 9-not-10 boundary is reasonable. Verification clarity is clear: the three-branch acceptance condition (establishment with quantified location, regional exclusion, or rigorous no-go) evaluates the stated problem without narrowing the region, observable, or answer form, and explicitly rejects phenomenological-only answers per the source's first-principles demand. Verification difficulty 8 is correctly reasoned under the cheapest-sound-branch rule: the no-go branch is high-D and not cheapest, the simulation branch permits bounded replay of numerical pipelines (R) but leaves a long, technique-novel derivation-review residual on complex-action method validity and error-control arguments that are mutually dependent, squarely in the 7-9 band; no burden is shifted into a specification gap and no proxy benchmark is invented. CI is handled honestly and separately: ci_status 'solution-reviewer-only', no oracle-like contract, and the pseudocode names a concrete terminating replay procedure with defined inputs/outputs while correctly declining to claim automation for the derivation-review residue. No resolved/refuted/major-progress judgment depends on agent-created proofs or computations. All public-facing fields are in English, and the definitions read as a concise academic introduction and problem statement rather than a bare task. No load-bearing judgment is unsupported; accept."
}
